<?xml version="1.0" encoding="UTF-8"?>
<xs:schema xmlns:xs="http://www.w3.org/2001/XMLSchema" elementFormDefault="qualified"
    targetNamespace="http://www.ftn.uns.ac.rs/xmlbsep/company/invoice"
    xmlns:prt="http://www.ftn.uns.ac.rs/xmlbsep/company/invoice">

    <xs:element name="partner">
        <xs:complexType>
            <xs:sequence>
                <xs:element name="address">
                    <xs:simpleType>
                        <xs:restriction base="xs:string">
                            <xs:minLength value="1"/>
                            <xs:maxLength value="255"/>
                        </xs:restriction>
                    </xs:simpleType>
                </xs:element>
                <xs:element name="name">
                    <xs:simpleType>
                        <xs:restriction base="xs:string">
                            <xs:maxLength value="255"/>
                            <xs:minLength value="1"/>
                        </xs:restriction>
                    </xs:simpleType>
                </xs:element>
                <xs:element name="pib">
                    <xs:simpleType>
                        <xs:restriction base="xs:string">
                            <xs:minLength value="1"/>
                            <xs:maxLength value="11"/>
                        </xs:restriction>
                    </xs:simpleType>
                </xs:element>
                <xs:element name="base_rest_url">
                    <xs:simpleType>
                        <xs:restriction base="xs:string">
                            <xs:minLength value="1"/>
                        </xs:restriction>
                    </xs:simpleType>
                </xs:element>
                <xs:element maxOccurs="unbounded" name="account">
                    <xs:complexType>
                        <xs:sequence>
                            <xs:element name="account_number">
                                <xs:simpleType>
                                    <xs:restriction base="xs:string">
                                        <xs:pattern value="\d{3}-\d{13}-\d{2}"/>
                                        <xs:length value="20"/>
                                    </xs:restriction>
                                </xs:simpleType>
                            </xs:element>
                        </xs:sequence>
                    </xs:complexType>
                </xs:element>
            </xs:sequence>
        </xs:complexType>
    </xs:element>
</xs:schema>
